Sheet: Day 1
A1: Dose (mg/L) | B1: Replicate | C1: Alive | D1: Dead | E1: Total Dead | F1: Deformities | G1: Total Deform | H1: Hatched | I1: Notes
A2: 1000 | B2: A | C2: 18 | D2: 2 | E2: 2 | F2: 0 | G2: 0 | H2: 0 | I2: Death -> Stone(s)
A3: 1000 | B3: B | C3: 15 | D3: 5 | E3: 5 | F3: 0 | G3: 0 | H3: 0 | I3: Death -> Stone(s)
A4: 1000 | B4: C | C4: 18 | D4: 2 | E4: 2 | F4: 0 | G4: 0 | H4: 0 | I4: Death -> Stone(s)
A5: of:=([.A2]/10) -> 100 | B5: A | C5: 16 | D5: 4 | E5: 4 | F5: 0 | G5: 0 | H5: 0 | I5: Death -> Stone(s)
A6: of:=([.A3]/10) -> 100 | B6: B | C6: 19 | D6: 1 | E6: 1 | F6: 0 | G6: 0 | H6: 0 | I6: Death -> Stone(s)
A7: of:=([.A4]/10) -> 100 | B7: C | C7: 19 | D7: 1 | E7: 1 | F7: 0 | G7: 0 | H7: 0 | I7: Death -> Stone(s)
A8: of:=([.A5]/10) -> 10 | B8: A | C8: 18 | D8: 2 | E8: 2 | F8: 0 | G8: 0 | H8: 0 | I8: Death -> Stone(s)
A9: of:=([.A6]/10) -> 10 | B9: B | C9: 19 | D9: 1 | E9: 1 | F9: 0 | G9: 0 | H9: 0 | I9: Death -> Stone(s)
A10: of:=([.A7]/10) -> 10 | B10: C | C10: 18 | D10: 2 | E10: 2 | F10: 0 | G10: 0 | H10: 0 | I10: Death -> Stone(s)
A11: of:=([.A8]/10) -> 1 | B11: A | C11: 19 | D11: 1 | E11: 1 | F11: 0 | G11: 0 | H11: 0 | I11: Death -> Stone(s)
A12: of:=([.A9]/10) -> 1 | B12: B | C12: 19 | D12: 1 | E12: 1 | F12: 0 | G12: 0 | H12: 0 | I12: Death -> Stone(s)
A13: of:=([.A10]/10) -> 1 | B13: C | C13: 20 | D13: 0 | E13: 0 | F13: 0 | G13: 0 | H13: 0
A14: of:=([.A11]/10) -> 0.1 | B14: A | C14: 18 | D14: 2 | E14: 2 | F14: 0 | G14: 0 | H14: 0 | I14: Death -> Stone(s)
A15: of:=([.A12]/10) -> 0.1 | B15: B | C15: 17 | D15: 3 | E15: 3 | F15: 0 | G15: 0 | H15: 0 | I15: Death -> Stone(s)
A16: of:=([.A13]/10) -> 0.1 | B16: C | C16: 18 | D16: 2 | E16: 2 | F16: 0 | G16: 0 | H16: 0 | I16: Death -> Stone(s)
A17: of:=([.A16]*0) -> 0 | B17: A | C17: 19 | D17: 1 | E17: 1 | F17: 0 | G17: 0 | H17: 0 | I17: Death -> Stone(s)
A18: of:=([.A17]*0) -> 0 | B18: B | C18: 17 | D18: 3 | E18: 3 | F18: 0 | G18: 0 | H18: 0 | I18: Death -> Stone(s)
A19: of:=([.A18]*0) -> 0 | B19: C | C19: 17 | D19: 2 | E19: 2 | F19: 0 | G19: 0 | H19: 0 | I19: Death -> Stone(s)

Sheet: Day 5
A1: Dose (mg/L) | B1: Replicate | C1: Alive | D1: Dead | E1: Total Dead | F1: Deformities | G1: Total Deform | H1: Hatched | I1: Notes
A2: 1000 | B2: A | C2: 16 | D2: 1 | E2: of:=(20 - [.C2]) -> 4 | F2: 1 | G2: 2 | H2: 16 | I2: stunted development, Curved Spine
A3: 1000 | B3: B | C3: 14 | D3: 0 | E3: 5 | F3: 0 | G3: 1 | H3: 14 | I3: miscount, severely bent tail
A4: 1000 | B4: C | C4: 17 | D4: 0 | E4: of:=(20 - [.C4]) -> 3 | F4: 0 | G4: 0 | H4: 17
A5: of:=([.A2]/10) -> 100 | B5: A | C5: 13 | D5: 1 | E5: of:=(20 - [.C5]) -> 7 | F5: 0 | G5: 1 | H5: 13 | I5: stunted development w/ severely bent tail
A6: of:=([.A3]/10) -> 100 | B6: B | C6: 18 | D6: 0 | E6: of:=(20 - [.C6]) -> 2 | F6: 0 | G6: 0 | H6: 18
A7: of:=([.A4]/10) -> 100 | B7: C | C7: 18 | D7: 0 | E7: of:=(20 - [.C7]) -> 2 | F7: 2 | G7: 2 | H7: 18 | I7: stunted development, Curved spine
A8: of:=([.A5]/10) -> 10 | B8: A | C8: 15 | D8: 0 | E8: of:=(20 - [.C8]) -> 5 | F8: 0 | G8: 0 | H8: 15
A9: of:=([.A6]/10) -> 10 | B9: B | C9: 19 | D9: 0 | E9: of:=(20 - [.C9]) -> 1 | F9: 0 | G9: 0 | H9: 19
A10: of:=([.A7]/10) -> 10 | B10: C | C10: 18 | D10: 0 | E10: of:=(20 - [.C10]) -> 2 | F10: 0 | G10: 0 | H10: 18
A11: of:=([.A8]/10) -> 1 | B11: A | C11: 19 | D11: 0 | E11: of:=(20 - [.C11]) -> 1 | F11: 1 | G11: 2 | H11: 19 | I11: stunted Development, Curved spine
A12: of:=([.A9]/10) -> 1 | B12: B | C12: 19 | D12: 0 | E12: of:=(20 - [.C12]) -> 1 | F12: 0 | G12: 0 | H12: 19
A13: of:=([.A10]/10) -> 1 | B13: C | C13: 20 | D13: 0 | E13: of:=(20 - [.C13]) -> 0 | F13: 0 | G13: 0 | H13: 20
A14: of:=([.A11]/10) -> 0.1 | B14: A | C14: 16 | D14: 0 | E14: 3 | F14: 0 | G14: 0 | H14: 16 | I14: miscount
A15: of:=([.A12]/10) -> 0.1 | B15: B | C15: 15 | D15: 0 | E15: 4 | F15: 0 | G15: 0 | H15: 15
A16: of:=([.A13]/10) -> 0.1 | B16: C | C16: 16 | D16: 1 | E16: of:=(20 - [.C16]) -> 4 | F16: 1 | G16: 2 | H16: 15
A17: of:=([.A16]*0) -> 0 | B17: A | C17: 18 | D17: 0 | E17: of:=(20 - [.C17]) -> 2 | F17: 1 | G17: 1 | H17: 18 | I17: Curved Spines
A18: of:=([.A17]*0) -> 0 | B18: B | C18: 16 | D18: 0 | E18: of:=(20 - [.C18]) -> 4 | F18: 0 | G18: 0 | H18: 16 | I18: Curved spines
A19: of:=([.A18]*0) -> 0 | B19: C | C19: 17 | D19: 0 | E19: 2 | F19: 0 | G19: 0 | H19: 17 | I19: miscount